Headline,Date
"Macquarie downgrades NIO on weak guide, demand concerns",2024-11-21 18:24:10
"NIO Launches Third EV Brand, Firefly, Targeting Compact Market",2024-11-21 18:24:10
"Should You Buy, Sell or Hold NIO Stock Post Mixed Q3 Results?",2024-11-21 18:24:10
"NIO Q3 Loss Wider Than Expected, Revenues Miss, Q4 View Solid",2024-11-21 18:24:10
Nio sees Q4 revenue RMB 19.68B-RMB 20.38B,2024-11-21 18:24:10
Nio reports Q3 EPS (RMB 2.50) vs. (RMB 2.67) last year,2024-11-21 18:24:10
NIO Inc (NIO) Q3 2024 Earnings Call Highlights: Record Deliveries Amidst Revenue Challenges,2024-11-21 18:24:10
Q3 2024 NIO Inc Earnings Call,2024-11-21 18:24:10
Nio (NIO) Q3 2024 Earnings Call Transcript,2024-11-20 18:24:10
"Stocks to Watch Wednesday: Nvidia, Target, NIO",2024-11-20 18:24:10
"Trending tickers: Nvidia, Nokia, Walmart, Volkswagen and British Land",2024-11-20 18:24:10
NIO’s Net Loss Widens on Lower Revenue Amid EV Pricing Pressure,2024-11-20 18:24:10
NIO Inc. Reports Unaudited Third Quarter 2024 Financial Results,2024-11-20 18:24:10
"Nvidia Q3 earnings, Fed commentary: What to Watch",2024-11-19 18:24:10
Nio Faces Key Q3 Test as EV Deliveries Rise and Hybrid Plans Take Shape,2024-11-19 18:24:10
What's Going On With NIO Stock Following Strong Q3 Results From Top Peer XPeng?,2024-11-19 18:24:10
Billionaire Israel Englander Dumped 90% of Millennium's Stake in Palantir in Favor of This Hypergrowth Electric-Vehicle (EV) Stock,2024-11-19 18:24:10
Things to Note Ahead of NIO's Q3 Earnings: Is the Stock a Buy Now?,2024-11-18 18:24:10
Should You Buy Nio Stock While It's Below Its IPO Price?,2024-11-17 18:24:10
