Headline,Date
"These Stocks Moved the Most Today: Nvidia, Alphabet, Super Micro, Snowflake, Deere, MicroStrategy, PDD, and More",2024-11-21 18:44:35
"MongoDB, Other Data Software Stocks Rally On Strong Snowflake Results",2024-11-21 18:44:35
Why Are Snowflake (SNOW) Shares Soaring Today,2024-11-21 18:44:35
Here's Why Snowflake Stock Skyrocketed Today,2024-11-21 18:44:35
Snowflake Stock Has Best Day Ever After Earnings. It May Mark the End of  the Nvidia Powered Chip Trade.,2024-11-21 18:44:35
Snowflake Stock Soars on Wall Street Beat,2024-11-21 18:44:35
Snowflake Shares Soar by Most in Four Years After Strong Outlook,2024-11-21 18:44:35
"Snowflake Q3 Earnings Beat Estimates, Revenues Rise Y/Y, Stock Up",2024-11-21 18:44:35
Snowflake Stock Explodes Over 30% on AI Growth and Game-Changing Partnership,2024-11-21 18:44:35
Q3 2025 Snowflake Inc Earnings Call,2024-11-21 18:44:35
"Snowflake shares surge on rosy forecast, AI deal with Anthropic",2024-11-21 18:44:35
"Snowflake stock skyrockets by 25% on Q3 beat, guidance raise",2024-11-21 18:44:35
"Snowflake Stock Surges as Revenue, Adjusted Profits Surpass Estimates",2024-11-21 18:44:35
"Snowflake Delivers Q3 Earnings, Revenue Beat. 'Turning Point' In Snowflake Story?",2024-11-21 18:44:35
Snowflake Stock Soars After Earnings Crush Expectations,2024-11-21 18:44:35
"Snowflake jumps 20% after lifting product revenue outlook, Q3 beat",2024-11-21 18:44:35
Snowflake Inc (SNOW) Q3 2025 Earnings Call Highlights: Strong Revenue Growth and Strategic AI ...,2024-11-21 18:44:35
Snowflake (SNOW) Q3 2025 Earnings Call Transcript,2024-11-21 18:44:35
"Snowflake Price Levels to Watch as Stock Pops 20% on Strong Earnings, Outlook",2024-11-21 18:44:35
Snowflake (SNOW) Q3 Earnings: How Key Metrics Compare to Wall Street Estimates,2024-11-20 18:44:35
Snowflake Inc. (SNOW) Expands Microsoft Partnership to Enhance AI Application Development with New Power Platform Connector,2024-11-20 18:44:35
Snowflake Inc. (SNOW) Tops Q3 Earnings and Revenue Estimates,2024-11-20 18:44:35
Snowflake's Sales Soar Despite Wider Loss,2024-11-20 18:44:35
Snowflake shares pop on revenue beat and strong sales outlook,2024-11-20 18:44:35
"Snowflake (NYSE:SNOW) Surprises With Q3 Sales, Stock Jumps 13.3%",2024-11-20 18:44:35
"Snowflake lifts product revenue forecast, enters AI deal with Anthropic",2024-11-20 18:44:35
Snowflake and Anthropic Team Up to Bring Claude Models Directly to the AI Data Cloud,2024-11-20 18:44:35
"Snowflake Agrees to Acquire Open Data Integration Platform, Datavolo",2024-11-20 18:44:35
Snowflake Reports Financial Results for the Third Quarter of Fiscal 2025,2024-11-20 18:44:35
Snowflake Inc. (SNOW) Faces Investor Caution: Analyst Maintains Overweight Rating,2024-11-20 18:44:35
Snowflake Earnings Due. Is Snowflake Stock A Buy Or Sell?,2024-11-20 18:44:35
Snowflake Inc. (SNOW) Enhances Cross-Cloud Collaboration to Accelerate AI App Development and Data Sharing,2024-11-20 18:44:35
Snowflake Inc. (SNOW): Citi Lowers Price Target to $183 but Highlights Strong Q3 Outlook and GenAI Growth Potential,2024-11-20 18:44:35
Snowflake and Microsoft Simplify AI App Development and Data Collaboration with Connector for Microsoft Power Platform and Microsoft Dynamics 365,2024-11-19 18:44:35
Snowflake Inc (SNOW)’s AI Edge: Why Analysts Are Betting on Future Growth,2024-11-19 18:44:35
Snowflake (SNOW) Reports Earnings Tomorrow: What To Expect,2024-11-19 18:44:35
Could Snowflake Inc. (SNOW) Grow 10x Over the Next 3 Years?,2024-11-18 18:44:35
"Snowflake Set to Report Q3 Earnings: Buy, Hold or Sell SNOW Stock?",2024-11-18 18:44:35
Wall Street Bulls Look Optimistic About Snowflake (SNOW): Should You Buy?,2024-11-18 18:44:35
Is Snowflake Inc. (SNOW) the Best Predictive Analytics Stock to Invest in Now?,2024-11-18 18:44:35
