Company,Title,Published,Source,Summary
news_nio,"Published: November 18, 2024",Unknown,The Motley Fool,"This article offered an in-depth analysis of NIO's anticipated third-quarter results, discussing expected vehicle delivery numbers and potential revenue figures. ""NIO's Upcoming Earnings: Can the EV Maker Meet Expectations?"""
news_nio,"Published: November 17, 2024",Unknown,CNBC,"CNBC examined the factors that could influence NIO's earnings, including market competition and production capabilities. ""Analysts Predict Strong Q3 for NIO Amidst EV Market Growth"""
news_nio,"Published: November 16, 2024",Unknown,Reuters,"Reuters reported on analysts' optimistic forecasts for NIO's third-quarter performance, citing increased demand for electric vehicles in China. ""NIO's Q3 Earnings: Key Metrics to Watch"""
news_nio,"Published: November 15, 2024",Unknown,Bloomberg,"Bloomberg highlighted critical metrics investors should monitor in NIO's upcoming earnings report, such as gross margins and vehicle delivery figures. ""NIO's Expansion Plans Ahead of Earnings Release"""
news_nio,"Published: November 14, 2024",Unknown,Financial Times,"This article discussed NIO's strategic expansion efforts and how they might impact the company's financial performance in the upcoming earnings report. ""Electric Vehicle Market Dynamics: NIO's Position Before Earnings"""
news_nio,"Published: November 13, 2024",Unknown,Wall Street Journal,"The Wall Street Journal analyzed the competitive landscape of the EV market and NIO's positioning ahead of its earnings announcement. ""NIO's Stock Performance Leading Up to Q3 Earnings"""
news_nio,"Published: November 12, 2024",Unknown,MarketWatch,"MarketWatch provided an overview of NIO's stock movements in the weeks preceding the earnings report, offering insights into investor sentiment. ""What Investors Should Know Before NIO's Earnings Call"""
news_nio,"Published: November 11, 2024",Unknown,Seeking Alpha,"Seeking Alpha outlined key considerations for investors ahead of NIO's earnings call, including potential risks and growth opportunities. ""NIO's Production Milestones Ahead of Earnings"""
news_nio,"Published: November 10, 2024",Unknown,TechCrunch,"TechCrunch reported on NIO's recent production achievements and their potential influence on the forthcoming earnings report. ""NIO's Market Share Growth Prior to Q3 Results"""
news_nio,"Published: November 9, 2024",Unknown,Forbes,Forbes analyzed NIO's increasing market share in the EV sector and its implications for the company's financial health ahead of the earnings release.
news_intu,"Published: November 15, 2024",Unknown,TechCrunch,"Summary: This article discusses Intuit's strategic investments in artificial intelligence, highlighting the launch of AI-powered features across its product suite, including QuickBooks and TurboTax, aimed at enhancing user experience and operational efficiency. ""Analysts Anticipate Strong Q1 Earnings for Intuit Amid Tax Season Preparations"""
news_intu,"Published: November 14, 2024",Unknown,Bloomberg,"Summary: Financial analysts express optimism about Intuit's upcoming earnings, citing increased adoption of its tax preparation software and small business solutions as key growth drivers for the quarter. ""Intuit's Mailchimp Acquisition: A Year Later, Integration and Performance Review"""
news_intu,"Published: November 12, 2024",Unknown,The Wall Street Journal,"Summary: An in-depth analysis of how Intuit's acquisition of Mailchimp has integrated into its ecosystem, evaluating the impact on revenue streams and customer engagement over the past year. ""Intuit Expands QuickBooks Online with New Features for Freelancers"""
news_intu,"Published: November 10, 2024",Unknown,Forbes,"Summary: Coverage of Intuit's recent updates to QuickBooks Online, introducing tools tailored for freelancers and gig economy workers to manage invoices, expenses, and tax obligations more effectively. ""Market Watch: Intuit's Stock Performance Ahead of Earnings Release"""
news_intu,"Published: November 9, 2024",Unknown,CNBC,"Summary: A market analysis focusing on Intuit's stock trajectory in the weeks leading up to its earnings report, examining investor sentiment and trading volumes. ""Intuit Partners with Major Banks to Enhance Financial Data Integration"""
news_intu,"Published: November 7, 2024",Unknown,Reuters,"Summary: Details on Intuit's new partnerships with several major banks to improve data integration within its financial software, aiming to provide users with more seamless and accurate financial insights. ""Intuit's Strategic Moves in the Small Business Sector: What to Expect"""
news_intu,"Published: November 5, 2024",Unknown,Business Insider,"Summary: An exploration of Intuit's recent strategies targeting small businesses, including product enhancements and marketing campaigns designed to capture a larger market share. ""Upcoming Earnings: What Analysts Predict for Intuit's Q1 Performance"""
news_intu,"Published: November 3, 2024",Unknown,MarketWatch,"Summary: A compilation of analyst forecasts for Intuit's first-quarter earnings, highlighting expectations for revenue growth and potential challenges. ""Intuit's Environmental Initiatives: Progress and Future Goals"""
news_intu,"Published: November 1, 2024",Unknown,The Guardian,"Summary: An overview of Intuit's sustainability efforts, including recent achievements in reducing carbon emissions and plans for future environmental initiatives. ""Consumer Trends: How Intuit's TurboTax Prepares for the Upcoming Tax Season"""
news_intu,"Published: October 30, 2024",Unknown,USA Today,"Summary: Insights into how Intuit is gearing up for the upcoming tax season, with a focus on new features in TurboTax designed to simplify the filing process for consumers."
news_panw,"Published: November 5, 2024",Unknown,The Motley Fool,"Summary: An analysis of anticipated outcomes for Palo Alto Networks' upcoming earnings report, focusing on revenue projections and market expectations. ""Cybersecurity Stocks to Watch Ahead of Earnings Season"""
news_panw,"Published: November 7, 2024",Unknown,CNBC,"Summary: A feature on key cybersecurity companies, including Palo Alto Networks, highlighting factors that could influence their financial performance in the forthcoming earnings season. ""Analysts Predict Strong Q1 for Palo Alto Networks Amid Rising Cyber Threats"""
news_panw,"Published: November 8, 2024",Unknown,Reuters,"Summary: Analysts' forecasts suggesting robust quarterly results for Palo Alto Networks, driven by increased demand for cybersecurity solutions. ""Palo Alto Networks' Platform Strategy Poised to Drive Growth"""
news_panw,"Published: November 10, 2024",Unknown,Forbes,"Summary: An exploration of how the company's platformization approach may contribute to its financial success in the upcoming earnings report. ""What to Expect from Palo Alto Networks' Upcoming Earnings"""
news_panw,"Published: November 12, 2024",Unknown,Zacks Investment Research,"Summary: A detailed preview of expected earnings, revenue, and key metrics for Palo Alto Networks ahead of their financial disclosure. ""Palo Alto Networks Set to Announce Q1 Earnings: Key Factors to Watch"""
news_panw,"Published: November 13, 2024",Unknown,MarketWatch,"Summary: An article outlining critical elements investors should monitor in the forthcoming earnings release, including customer acquisition and product innovation. ""Cybersecurity Earnings Preview: Palo Alto Networks in Focus"""
news_panw,"Published: November 14, 2024",Unknown,Barron's,"Summary: A discussion on the cybersecurity sector's earnings outlook, with a particular emphasis on Palo Alto Networks' performance indicators. ""Palo Alto Networks Earnings: Will Platformization Pay Off?"""
news_panw,"Published: November 15, 2024",Unknown,Seeking Alpha,"Summary: An analysis questioning whether the company's strategy of integrating multiple security services into a single platform will reflect positively in the earnings report. ""Investors Eye Palo Alto Networks' Earnings Amid Cybersecurity Demand Surge"""
news_panw,"Published: November 17, 2024",Unknown,Bloomberg,"Summary: An overview of investor sentiment and expectations for Palo Alto Networks' earnings, considering the heightened demand for cybersecurity solutions. ""Palo Alto Networks Earnings: Key Metrics to Watch"""
news_panw,"Published: November 18, 2024",Unknown,The Street,Summary: A guide highlighting the essential financial metrics and business segments to focus on in the upcoming earnings announcement.
news_keys,"Published: November 5, 2024",Unknown,Unknown,"Keysight Technologies announced the date for releasing its Q4 and full-year 2024 financial results, scheduled for November 19, 2024. ""Analysts Anticipate Strong Earnings for Keysight Technologies Amid AI Sector Growth"""
news_keys,"Published: November 10, 2024",Unknown,Unknown,"Analysts projected robust earnings for Keysight Technologies, citing increased demand in the AI sector as a significant growth driver. ""Keysight Technologies Expands AI Testing Solutions Portfolio"""
news_keys,"Published: November 12, 2024",Unknown,Unknown,"Keysight announced the expansion of its AI testing solutions, aiming to support the growing needs of AI developers and researchers. ""Keysight Technologies Partners with Leading Semiconductor Firm to Enhance 5G Testing"""
news_keys,"Published: November 13, 2024",Unknown,Unknown,"The company entered into a partnership with a major semiconductor firm to advance 5G testing capabilities, enhancing its market position in telecommunications. ""Market Analysts Upgrade Keysight Technologies Ahead of Earnings Release"""
news_keys,"Published: November 14, 2024",Unknown,Unknown,"Several market analysts upgraded their ratings for Keysight Technologies, expressing optimism about the upcoming earnings report. ""Keysight Technologies to Participate in Upcoming Investor Conferences"""
news_keys,"Published: November 15, 2024",Unknown,Unknown,"The company announced its participation in several investor conferences, aiming to engage with stakeholders and discuss future strategies. ""Keysight Technologies Launches New Quantum Computing Test Solutions"""
news_keys,"Published: November 16, 2024",Unknown,Unknown,"Keysight introduced new test solutions for quantum computing, positioning itself in the emerging quantum technology market. ""Investors Eye Keysight Technologies' Earnings Amid Tech Sector Volatility"""
news_keys,"Published: November 17, 2024",Unknown,Unknown,"Investors closely monitored Keysight's upcoming earnings report, considering the broader volatility in the technology sector. ""Keysight Technologies Expands Global Presence with New R&D Center"""
news_sym,Sentiment: Positive,Unknown,Zacks Investment Research,"Date: November 13, 2024 Summary: Analysts project a 20.3% revenue increase for Symbotic's fourth quarter, expecting earnings of $0.03 per share, indicating significant growth. NASDAQ ""Symbotic Set to Post Quarterly Earnings on Monday"""
news_sym,Sentiment: Neutral,Unknown,ETF Daily News,"Date: November 16, 2024 Summary: Symbotic is scheduled to release its quarterly earnings data after the market closes on November 18th, with analysts expecting earnings of $0.03 per share. ETF DAILY NEWS ""Symbotic's Upcoming Earnings: What Investors Should Know"""
news_sym,Sentiment: Neutral,Unknown,MarketBeat,"Date: November 16, 2024 Summary: Symbotic is set to announce its quarterly earnings on November 18, 2024, with expectations of $0.03 earnings per share, reflecting a year-over-year increase of 137.5%."
news_wmt,"""Walmart's Q3 Earnings Preview: Analysts Anticipate Strong Sales Amid Inflation"" – Reuters",Unknown,Unknown,"Summary: Analysts predict robust third-quarter sales for Walmart, attributing potential growth to consumers seeking value during inflationary periods. ""Walmart's E-commerce Expansion: A Key Driver for Upcoming Earnings?"" – TechCrunch Summary: Explores how Walmart's investments in online shopping platforms may influence its financial outcomes in the forthcoming earnings report. ""Retail Giant Walmart Set to Surpass Earnings Expectations, Say Experts"" – CNBC Summary: Financial experts forecast that Walmart will exceed earnings projections, citing effective cost management and strategic pricing. ""Walmart's Strategic Price Cuts: Will They Boost Holiday Season Sales?"" – The Wall Street Journal Summary: Analyzes Walmart's recent price reduction strategies and their potential impact on consumer spending during the holiday season. ""Walmart's International Ventures: A Boon or Bane for Upcoming Earnings?"" – Financial Times Summary: Discusses the implications of Walmart's global operations on its financial health ahead of the earnings announcement. ""Walmart's Stock Performance: Investors Eyeing Positive Earnings Surprise"" – Bloomberg Summary: Highlights investor optimism surrounding Walmart's stock, fueled by expectations of favorable earnings results. ""Supply Chain Challenges: How Is Walmart Navigating the Crisis?"" – The New York Times Summary: Examines Walmart's strategies to mitigate supply chain disruptions and their potential effects on the company's earnings. ""Walmart's Workforce Investments: Preparing for a Strong Earnings Report?"" – Forbes Summary: Looks into Walmart's recent employee wage increases and training programs as factors that might influence its financial performance. ""Consumer Spending Shifts: Walmart Positioned to Benefit in Upcoming Earnings"" – MarketWatch Summary: Analyzes trends in consumer behavior favoring discount retailers like Walmart, potentially leading to positive earnings outcomes. ""Walmart's Digital Transformation: A Catalyst for Earnings Growth?"" – Business Insider Summary: Explores how Walmart's adoption of digital technologies could drive efficiency and profitability in the upcoming earnings report."
news_snow,"Published: November 18, 2024",Unknown,Unknown,"This article discusses expectations for Snowflake's third-quarter fiscal 2025 results, highlighting the company's strong portfolio and potential margin pressures due to rising GPU costs. YAHOO ""Snowflake Stock Is a Buy Before Earnings, Analysts Say. Just Look at Palantir."""
news_snow,"Published: November 13, 2024",Unknown,Unknown,"Analysts suggest that Snowflake is well-positioned to benefit from increased demand for generative AI, drawing parallels with Palantir's recent performance. BARRON'S ""Nvidia, Walmart, Deere, Target, Snowflake, and More Stocks to Watch This Week"""
news_snow,"Published: November 17, 2024",Unknown,Unknown,"This piece highlights key companies, including Snowflake, scheduled to release earnings reports, providing context for investors. BARRON'S ""Snowflake to Announce Financial Results for the Third Quarter of Fiscal 2025 on November 20, 2024"""
news_snow,"Published: November 5, 2024",Unknown,Unknown,"An official announcement from Snowflake regarding the date of their upcoming earnings release. SNOWFLAKE INVESTORS ""Snowflake: Riding The Avalanche Of Innovation"""
news_snow,"Published: November 14, 2024",Unknown,Unknown,"An analysis of Snowflake's growth potential and value proposition, emphasizing its unique consumption-based model and AI capabilities. ""Snowflake's AI Data Cloud: A Game Changer?"""
news_snow,"Published: November 10, 2024",Unknown,Unknown,"This article explores Snowflake's advancements in AI integration within its data cloud platform and the potential market impact. ""Snowflake's Strategic Partnerships Ahead of Earnings"""
news_snow,"Published: November 12, 2024",Unknown,Unknown,"A review of Snowflake's recent collaborations and their anticipated influence on the company's financial performance. ""Analysts Predict Strong Q3 for Snowflake Amid AI Boom"""
news_snow,"Published: November 15, 2024",Unknown,Unknown,"Market analysts forecast robust third-quarter results for Snowflake, citing the surge in AI-driven data solutions. ""Snowflake's Expansion into New Markets: What to Expect"""
news_snow,"Published: November 9, 2024",Unknown,Unknown,"An examination of Snowflake's entry into emerging markets and the potential implications for its growth trajectory. ""Investor Sentiment High as Snowflake's Earnings Approach"""
news_powl,Earnings To Watch: Powell (POWL) Reports Q3 Results Tomorrow,Unknown,Unknown,"Electrical energy control systems manufacturer Powell (NYSE:POWL) will be reporting results tomorrow after market hours. Here’s what to look for. StockStory • 7 days ago OSIS +2.47% POWL -3.20% Jim Cramer on Powell Industries, Inc. (POWL): ‘Up Almost 259% For The Year’ Jim Cramer on Powell Industries, Inc. (POWL): ‘Up Almost 259% For The Year’ We recently compiled a list of the Jim Cramer’s Best Performers List: Top 10 Stocks. In this article, we are going to take a look at where Powell Industries, Inc. (NASDAQ:POWL) stands against the other stocks on Jim Cramer’s list of best performers list. On Wednesday’s Mad Money episode, Jim Cramer took a deep dive into […] Insider Monkey • 10 days ago POWL -3.20% Powell's Q4 Earnings Coming Up: Should You Grab the Stock Now? Powell's Q4 Earnings Coming Up: Should You Grab the Stock Now? As POWL gears up to report fiscal fourth-quarter earnings, let us find out how the expectations stack up and whether it is the right time to buy the stock. Zacks • 10 days ago POWL -3.20% Powell Industries, Inc. (POWL) is Attracting Investor Attention: Here is What You Should Know Powell Industries, Inc. (POWL) is Attracting Investor Attention: Here is What You Should Know Powell Industries (POWL) has received quite a bit of attention from Zacks.com users lately. Therefore, it is wise to be aware of the facts that can impact the stock's prospects. Zacks • 10 days ago POWL -3.20% Powell Industries (POWL) Outperforms Broader Market: What You Need to Know Powell Industries (POWL) Outperforms Broader Market: What You Need to Know The latest trading day saw Powell Industries (POWL) settling at $352.37, representing a +1.73% change from its previous close. Zacks • Is Powell Industries, Inc.'s (NASDAQ:POWL) Recent Stock Performance Tethered To Its Strong Fundamentals? Is Powell Industries, Inc.'s (NASDAQ:POWL) Recent Stock Performance Tethered To Its Strong Fundamentals? Powell Industries (NASDAQ:POWL) has had a great run on the share market with its stock up by a significant 112% over... Simply Wall St. • 14 days ago POWL -3.20% Powell Industries Announces Date and Conference Call for Fiscal 2024 Fourth Quarter and Full Year Results Powell Industries Announces Date and Conference Call for Fiscal 2024 Fourth Quarter and Full Year Results HOUSTON, Nov. 05, 2024 (GLOBE NEWSWIRE) -- Powell Industries, Inc. (NASDAQ: POWL), a leading supplier of custom engineered solutions for the management, control and distribution of electrical energy, today announced that it will release results for the fiscal fourth quarter and year ended September 30, 2024 on Tuesday, November 19, 2024 after the market closes. In conjunction with the release, Powell Industries has scheduled a conference call, which will be broadcast live within the Investor Rel GlobeNewswire • 20 days ago POWL -3.20% Powell Industries Declares Quarterly Cash Dividend Powell Industries Declares Quarterly Cash Dividend HOUSTON, Nov. 05, 2024 (GLOBE NEWSWIRE) -- Powell Industries, Inc. (NASDAQ: POWL), a leading supplier of custom engineered solutions for the management, control and distribution of electrical energy, today announced that its Board of Directors has declared a quarterly cash dividend on the Company’s common stock of $0.2650 per share. The dividend is payable on December 18, 2024 to shareholders of record at the close of business on November 20, 2024. Powell Industries, Inc., headquartered in Houst GlobeNewswire • 20 days ago POWL -3.20% Powell Industries, Inc. (POWL) Is a Trending Stock: Facts to Know Before Betting on It Powell Industries, Inc. (POWL) Is a Trending Stock: Facts to Know Before Betting on It Powell Industries (POWL) has received quite a bit of attention from Zacks.com users lately. Therefore, it is wise to be aware of the facts that can impact the stock's prospects. Zacks • 21 days ago POWL -3.20% Powell Industries (POWL) Gains As Market Dips: What You Should Know Powell Industries (POWL) Gains As Market Dips: What You Should Know Powell Industries (POWL) closed the most recent trading day at $255.12, moving +0.28% from the previous trading session. Zacks • 25 days ago POWL -3.20% Powell (NASDAQ:POWL) Q2 Earnings: Leading The Electrical Systems Pack Powell (NASDAQ:POWL) Q2 Earnings: Leading The Electrical Systems Pack As the Q2 earnings season comes to a close, it’s time to take stock of this quarter’s best and worst performers in the electrical systems industry, including Powell (NASDAQ:POWL) and its peers."
